{
  "artifacts": [
    {
      "bytes": 16929792,
      "kind": "binary",
      "name": "rust_cli",
      "path": "target/release/tracerazor.exe",
      "present": true,
      "sha256": "7548683efc5aa9b7a20f5b6a2dabd3ca5d3326ac57b9bc53a1af1d7126c21ae1"
    },
    {
      "bytes": 13382,
      "kind": "paper",
      "name": "paper_pdf",
      "path": "paper/trice_v3_research_paper.pdf",
      "present": true,
      "sha256": "a63a553d01c2ff0e2fe4be7658334d05f74bf4adf64f7eb373ae01fb29a02a45"
    },
    {
      "bytes": 7591,
      "kind": "paper-manifest",
      "name": "paper_manifest",
      "path": "paper/trice_v3_research_manifest.json",
      "present": true,
      "sha256": "b7bd76063e5b53b98d934562f642e4778a59e1c0b03b229de03d3aa9701ef19e"
    },
    {
      "bytes": 16185,
      "kind": "proof-card",
      "name": "artifact_card",
      "path": "docs/trice_artifact_card.json",
      "present": true,
      "sha256": "2ca622a1999b25d27ecf92af85d4549d0d0bac5f9d663fef84cb8ae4851af10a"
    },
    {
      "bytes": 19194,
      "kind": "proof-card",
      "name": "contract_card",
      "path": "docs/trice_contract_card.json",
      "present": true,
      "sha256": "1837de7eda82dc02abf5d9568d307431aac5749ba3eefdbf5a0d2c20a85c4461"
    },
    {
      "bytes": 20152,
      "kind": "proof-card",
      "name": "crates_card",
      "path": "docs/trice_crates_card.json",
      "present": true,
      "sha256": "92f9bb02700bca505e64a665431e9b0e9c46458c87519d9d8cfd87538e412420"
    },
    {
      "bytes": 14071,
      "kind": "proof-card",
      "name": "install_card",
      "path": "docs/trice_install_card.json",
      "present": true,
      "sha256": "7855087064b41c51e9f41e160d8aa977c3a5baddbcaa1cea0ed3c7b2e8a1b618"
    },
    {
      "bytes": 7494,
      "kind": "proof-card",
      "name": "reproduction_card",
      "path": "docs/trice_reproduction_card.json",
      "present": true,
      "sha256": "34762f6ff0511476a038dd1d4bf52e6923aa1ca899280a717ecab15afd66df54"
    },
    {
      "bytes": 69670,
      "kind": "proof-card",
      "name": "research_card",
      "path": "docs/trice_research_card.json",
      "present": true,
      "sha256": "2095432965bb86bb3a559aa2bd2ef3375d688910ea4f00315fb75ac4c6019e18"
    },
    {
      "bytes": 117496,
      "kind": "trice-bundle",
      "name": "broad_evidence_bundle",
      "path": "benchmark/trice/results/v2-broad-smoke/trice_broad_smoke_evidence.trice.zip",
      "present": true,
      "sha256": "a43eeac3ba5239031376aa7b3be97e01ccada6c36648faa15e1c2b3e2d2d2564"
    },
    {
      "bytes": 25131,
      "kind": "trice-bundle",
      "name": "remote_smoke_bundle",
      "path": "benchmark/trice/results/v2-remote-smoke/trice_remote_smoke_evidence.trice.zip",
      "present": true,
      "sha256": "93f31fc51b6c75279b1dc8a637a46e51c7fd9f2aa3ea0ef45fe9d581ffef493d"
    },
    {
      "bytes": 6859719,
      "kind": "wheel",
      "name": "tracerazor-1.1.0-py3-none-win_amd64.whl",
      "path": "build/final-release-1.1.0-agent-native/tracerazor-1.1.0-py3-none-win_amd64.whl",
      "present": true,
      "sha256": "2a87bc3c2d6c2bd2a029724203f22591d1eeb6e12f1c8aea360b3808afb99f1f"
    }
  ],
  "cargo_sbom": {
    "bom": {
      "bomFormat": "CycloneDX",
      "components": [
        {
          "hashes": [
            {
              "alg": "SHA-256",
              "content": "320119579fcad9c21884f5c4861d16174d0e06250625266f50fe6898340abefa"
            }
          ],
          "name": "adler2",
          "purl": "pkg:cargo/adler2@2.0.1",
          "type": "library",
          "version": "2.0.1"
        },
        {
          "hashes": [
            {
              "alg": "SHA-256",
              "content": "b169f7a6d4742236a0a00c541b845991d0ac43e546831af1249753ab4c3aa3a0"
            }
          ],
          "name": "aes",
          "purl": "pkg:cargo/aes@0.8.4",
          "type": "library",
          "version": "0.8.4"
        },
        {
          "hashes": [
            {
              "alg": "SHA-256",
              "content": "5a15f179cd60c4584b8a8c596927aadc462e27f2ca70c04e0071964a73ba7a75"
            }
          ],
          "name": "ahash",
          "purl": "pkg:cargo/ahash@0.8.12",
          "type": "library",
          "version": "0.8.12"
        },
        {
          "hashes": [
            {
              "alg": "SHA-256",
              "content": "ddd31a130427c27518df266943a5308ed92d4b226cc639f5a8f1002816174301"
            }
          ],
          "name": "aho-corasick",
          "purl": "pkg:cargo/aho-corasick@1.1.4",
          "type": "library",
          "version": "1.1.4"
        },
        {
          "hashes": [
            {
              "alg": "SHA-256",
              "content": "819e7219dbd41043ac279b19830f2efc897156490d7fd6ea916720117ee66311"
            }
          ],
          "name": "android_system_properties",
          "purl": "pkg:cargo/android_system_properties@0.1.5",
          "type": "library",
          "version": "0.1.5"
        },
        {
          "hashes": [
            {
              "alg": "SHA-256",
              "content": "4b46cbb362ab8752921c97e041f5e366ee6297bd428a31275b9fcf1e380f7299"
            }
          ],
          "name": "anes",
          "purl": "pkg:cargo/anes@0.1.6",
          "type": "library",
          "version": "0.1.6"
        },
        {
          "hashes": [
            {
              "alg": "SHA-256",
              "content": "824a212faf96e9acacdbd09febd34438f8f711fb84e09a8916013cd7815ca28d"
            }
          ],
          "name": "anstream",
          "purl": "pkg:cargo/anstream@1.0.0",
          "type": "library",
          "version": "1.0.0"
        },
        {
          "hashes": [
            {
              "alg": "SHA-256",
              "content": "940b3a0ca603d1eade50a4846a2afffd5ef57a9feac2c0e2ec2e14f9ead76000"
            }
          ],
          "name": "anstyle",
          "purl": "pkg:cargo/anstyle@1.0.14",
          "type": "library",
          "version": "1.0.14"
        },
        {
          "hashes": [
            {
              "alg": "SHA-256",
              "content": "52ce7f38b242319f7cabaa6813055467063ecdc9d355bbb4ce0c68908cd8130e"
            }
          ],
          "name": "anstyle-parse",
          "purl": "pkg:cargo/anstyle-parse@1.0.0",
          "type": "library",
          "version": "1.0.0"
        },
        {
          "hashes": [
            {
              "alg": "SHA-256",
              "content": "40c48f72fd53cd289104fc64099abca73db4166ad86ea0b4341abe65af83dadc"
            }
          ],
          "name": "anstyle-query",
          "purl": "pkg:cargo/anstyle-query@1.1.5",
          "type": "library",
          "version": "1.1.5"
        },
        {
          "hashes": [
            {
              "alg": "SHA-256",
              "content": "291e6a250ff86cd4a820112fb8898808a366d8f9f58ce16d1f538353ad55747d"
            }
          ],
          "name": "anstyle-wincon",
          "purl": "pkg:cargo/anstyle-wincon@3.0.11",
          "type": "library",
          "version": "3.0.11"
        },
        {
          "hashes": [
            {
              "alg": "SHA-256",
              "content": "2a4385e2e34eb35d6b3efe798b9eb88096925d87726c0798709bf56d9ed84af3"
            }
          ],
          "name": "anyhow",
          "purl": "pkg:cargo/anyhow@1.0.103",
          "type": "library",
          "version": "1.0.103"
        },
        {
          "hashes": [
            {
              "alg": "SHA-256",
              "content": "47e4f2b81832e72834d7518d8487a0396a28cc408186a2e8854c0f98011faf12"
            }
          ],
          "name": "assert-json-diff",
          "purl": "pkg:cargo/assert-json-diff@2.0.2",
          "type": "library",
          "version": "2.0.2"
        },
        {
          "hashes": [
            {
              "alg": "SHA-256",
              "content": "2aa3a22042e45de04255c7bf3626e239f450200fd0493c1e382263544b20aea6"
            }
          ],
          "name": "assert_cmd",
          "purl": "pkg:cargo/assert_cmd@2.2.2",
          "type": "library",
          "version": "2.2.2"
        },
        {
          "hashes": [
            {
              "alg": "SHA-256",
              "content": "9035ad2d096bed7955a320ee7e2230574d28fd3c3a0f186cbea1ff3c7eed5dbb"
            }
          ],
          "name": "async-trait",
          "purl": "pkg:cargo/async-trait@0.1.89",
          "type": "library",
          "version": "0.1.89"
        },
        {
          "hashes": [
            {
              "alg": "SHA-256",
              "content": "1505bd5d3d116872e7271a6d4e16d81d0c8570876c8de68093a09ac269d8aac0"
            }
          ],
          "name": "atomic-waker",
          "purl": "pkg:cargo/atomic-waker@1.1.2",
          "type": "library",
          "version": "1.1.2"
        },
        {
          "hashes": [
            {
              "alg": "SHA-256",
              "content": "3c1e7e457ea78e524f48639f551fd79703ac3f2237f5ecccdf4708f8a75ad373"
            }
          ],
          "name": "auto-future",
          "purl": "pkg:cargo/auto-future@1.0.0",
          "type": "library",
          "version": "1.0.0"
        },
        {
          "hashes": [
            {
              "alg": "SHA-256",
              "content": "c08606f8c3cbf4ce6ec8e28fb0014a2c086708fe954eaa885384a6165172e7e8"
            }
          ],
          "name": "autocfg",
          "purl": "pkg:cargo/autocfg@1.5.0",
          "type": "library",
          "version": "1.5.0"
        },
        {
          "hashes": [
            {
              "alg": "SHA-256",
              "content": "edca88bc138befd0323b20752846e6587272d3b03b0343c8ea28a6f819e6e71f"
            }
          ],
          "name": "axum",
          "purl": "pkg:cargo/axum@0.7.9",
          "type": "library",
          "version": "0.7.9"
        },
        {
          "hashes": [
            {
              "alg": "SHA-256",